,Name,Location,Contact Number,Sunday,Monday,Tuesday,Wednesday,Thursday,Friday,Saturday
57,Khan's Cave Asian Tavern & Grill,"9350 Clairemont Mesa Blvd., Ste F San Diego, CA 92123",(858) 279-9799,Bussines hour: 3 Happy hour: Closed Today deal: Closed,"Bussines hour: : Happy hour: 3:00 PM -  7:00 PM Today deal: $3.50 Fireball Shooter / $4.75 - $5 Bottled Beer / $6 Draft Beer of the Day, Small Warm Sake / $7 House Select Wine by the Glass / $7 - $8.25 Draft Beer / $8.50 Martinis / $8.75 Beer Sampler: Three 5oz. Pours / $9 Specialty Cocktails $6.50 Beef Curry Dumplings, Side Salad, Garlic Edamame, Garlic Naan, Fries / $7.50 Steamed Pork or Fried Chicken Gyoza, XLB, Fried Brussels Sprouts, Waffle Fries, Veggie or Chicken Egg Rolls, Cream Cheese Wonton, Egg Fried Rice, Truffle Fries / $8.50 Seaweed Salad, Garlic Naan Bruschetta, Spicy Eggplant, Broccoli or Green Beans Sauté, Mixed Asian Greens, Yaki Soba (plain) / $9.50 Spicy Popcorn Chicken, Chicken or Vegetarian Lettuce Wraps, BBQ Pork Sliders, Dan Dan Noodles, Khan's Hot Dog, Dumpling Sampler, Tempura Shrimp / $10.50 Roasted Duck / $12.50 Seared Skirt Steak, Ginger Glazed or Panko Shrimp Basket, Sautéed Garlic Butter Shrimp, Peppery Fried or Firecracker Calamari / $13.50 Wings (Sriracha, Peppery Fried, Sweet & Spicy), Pub Steak & Fries, Aloha Loco Moco, Lamb or Steak Brochette, Khan's Teriyaki Glazed BLT Burger, Ahi Poke Salad, Seared Sesame Ahi Salad ","Bussines hour: 3 Happy hour: 3:00 PM -  7:00 PM Today deal: $3.50 Fireball Shooter / $4.75 - $5 Bottled Beer / $6 Draft Beer of the Day, Small Warm Sake / $7 House Select Wine by the Glass / $7 - $8.25 Draft Beer / $8.50 Martinis / $8.75 Beer Sampler: Three 5oz. Pours / $9 Specialty Cocktails $6.50 Beef Curry Dumplings, Side Salad, Garlic Edamame, Garlic Naan, Fries / $7.50 Steamed Pork or Fried Chicken Gyoza, XLB, Fried Brussels Sprouts, Waffle Fries, Veggie or Chicken Egg Rolls, Cream Cheese Wonton, Egg Fried Rice, Truffle Fries / $8.50 Seaweed Salad, Garlic Naan Bruschetta, Spicy Eggplant, Broccoli or Green Beans Sauté, Mixed Asian Greens, Yaki Soba (plain) / $9.50 Spicy Popcorn Chicken, Chicken or Vegetarian Lettuce Wraps, BBQ Pork Sliders, Dan Dan Noodles, Khan's Hot Dog, Dumpling Sampler, Tempura Shrimp / $10.50 Roasted Duck / $12.50 Seared Skirt Steak, Ginger Glazed or Panko Shrimp Basket, Sautéed Garlic Butter Shrimp, Peppery Fried or Firecracker Calamari / $13.50 Wings (Sriracha, Peppery Fried, Sweet & Spicy), Pub Steak & Fries, Aloha Loco Moco, Lamb or Steak Brochette, Khan's Teriyaki Glazed BLT Burger, Ahi Poke Salad, Seared Sesame Ahi Salad ","Bussines hour: 0 Happy hour: 3:00 PM -  7:00 PM Today deal: $3.50 Fireball Shooter / $4.75 - $5 Bottled Beer / $6 Draft Beer of the Day, Small Warm Sake / $7 House Select Wine by the Glass / $7 - $8.25 Draft Beer / $8.50 Martinis / $8.75 Beer Sampler: Three 5oz. Pours / $9 Specialty Cocktails $6.50 Beef Curry Dumplings, Side Salad, Garlic Edamame, Garlic Naan, Fries / $7.50 Steamed Pork or Fried Chicken Gyoza, XLB, Fried Brussels Sprouts, Waffle Fries, Veggie or Chicken Egg Rolls, Cream Cheese Wonton, Egg Fried Rice, Truffle Fries / $8.50 Seaweed Salad, Garlic Naan Bruschetta, Spicy Eggplant, Broccoli or Green Beans Sauté, Mixed Asian Greens, Yaki Soba (plain) / $9.50 Spicy Popcorn Chicken, Chicken or Vegetarian Lettuce Wraps, BBQ Pork Sliders, Dan Dan Noodles, Khan's Hot Dog, Dumpling Sampler, Tempura Shrimp / $10.50 Roasted Duck / $12.50 Seared Skirt Steak, Ginger Glazed or Panko Shrimp Basket, Sautéed Garlic Butter Shrimp, Peppery Fried or Firecracker Calamari / $13.50 Wings (Sriracha, Peppery Fried, Sweet & Spicy), Pub Steak & Fries, Aloha Loco Moco, Lamb or Steak Brochette, Khan's Teriyaki Glazed BLT Burger, Ahi Poke Salad, Seared Sesame Ahi Salad ","Bussines hour:   Happy hour: 3:00 PM -  7:00 PM Today deal: $3.50 Fireball Shooter / $4.75 - $5 Bottled Beer / $6 Draft Beer of the Day, Small Warm Sake / $7 House Select Wine by the Glass / $7 - $8.25 Draft Beer / $8.50 Martinis / $8.75 Beer Sampler: Three 5oz. Pours / $9 Specialty Cocktails $6.50 Beef Curry Dumplings, Side Salad, Garlic Edamame, Garlic Naan, Fries / $7.50 Steamed Pork or Fried Chicken Gyoza, XLB, Fried Brussels Sprouts, Waffle Fries, Veggie or Chicken Egg Rolls, Cream Cheese Wonton, Egg Fried Rice, Truffle Fries / $8.50 Seaweed Salad, Garlic Naan Bruschetta, Spicy Eggplant, Broccoli or Green Beans Sauté, Mixed Asian Greens, Yaki Soba (plain) / $9.50 Spicy Popcorn Chicken, Chicken or Vegetarian Lettuce Wraps, BBQ Pork Sliders, Dan Dan Noodles, Khan's Hot Dog, Dumpling Sampler, Tempura Shrimp / $10.50 Roasted Duck / $12.50 Seared Skirt Steak, Ginger Glazed or Panko Shrimp Basket, Sautéed Garlic Butter Shrimp, Peppery Fried or Firecracker Calamari / $13.50 Wings (Sriracha, Peppery Fried, Sweet & Spicy), Pub Steak & Fries, Aloha Loco Moco, Lamb or Steak Brochette, Khan's Teriyaki Glazed BLT Burger, Ahi Poke Salad, Seared Sesame Ahi Salad ","Bussines hour: P Happy hour: 3:00 PM -  7:00 PM Today deal: $3.50 Fireball Shooter / $4.75 - $5 Bottled Beer / $6 Draft Beer of the Day, Small Warm Sake / $7 House Select Wine by the Glass / $7 - $8.25 Draft Beer / $8.50 Martinis / $8.75 Beer Sampler: Three 5oz. Pours / $9 Specialty Cocktails $6.50 Beef Curry Dumplings, Side Salad, Garlic Edamame, Garlic Naan, Fries / $7.50 Steamed Pork or Fried Chicken Gyoza, XLB, Fried Brussels Sprouts, Waffle Fries, Veggie or Chicken Egg Rolls, Cream Cheese Wonton, Egg Fried Rice, Truffle Fries / $8.50 Seaweed Salad, Garlic Naan Bruschetta, Spicy Eggplant, Broccoli or Green Beans Sauté, Mixed Asian Greens, Yaki Soba (plain) / $9.50 Spicy Popcorn Chicken, Chicken or Vegetarian Lettuce Wraps, BBQ Pork Sliders, Dan Dan Noodles, Khan's Hot Dog, Dumpling Sampler, Tempura Shrimp / $10.50 Roasted Duck / $12.50 Seared Skirt Steak, Ginger Glazed or Panko Shrimp Basket, Sautéed Garlic Butter Shrimp, Peppery Fried or Firecracker Calamari / $13.50 Wings (Sriracha, Peppery Fried, Sweet & Spicy), Pub Steak & Fries, Aloha Loco Moco, Lamb or Steak Brochette, Khan's Teriyaki Glazed BLT Burger, Ahi Poke Salad, Seared Sesame Ahi Salad ","Bussines hour: M Happy hour: Not Happy Hour Today deal: $3.50 Fireball Shooter / $4.75 - $5 Bottled Beer / $6 Draft Beer of the Day, Small Warm Sake / $7 House Select Wine by the Glass / $7 - $8.25 Draft Beer / $8.50 Martinis / $8.75 Beer Sampler: Three 5oz. Pours / $9 Specialty Cocktails $6.50 Beef Curry Dumplings, Side Salad, Garlic Edamame, Garlic Naan, Fries / $7.50 Steamed Pork or Fried Chicken Gyoza, XLB, Fried Brussels Sprouts, Waffle Fries, Veggie or Chicken Egg Rolls, Cream Cheese Wonton, Egg Fried Rice, Truffle Fries / $8.50 Seaweed Salad, Garlic Naan Bruschetta, Spicy Eggplant, Broccoli or Green Beans Sauté, Mixed Asian Greens, Yaki Soba (plain) / $9.50 Spicy Popcorn Chicken, Chicken or Vegetarian Lettuce Wraps, BBQ Pork Sliders, Dan Dan Noodles, Khan's Hot Dog, Dumpling Sampler, Tempura Shrimp / $10.50 Roasted Duck / $12.50 Seared Skirt Steak, Ginger Glazed or Panko Shrimp Basket, Sautéed Garlic Butter Shrimp, Peppery Fried or Firecracker Calamari / $13.50 Wings (Sriracha, Peppery Fried, Sweet & Spicy), Pub Steak & Fries, Aloha Loco Moco, Lamb or Steak Brochette, Khan's Teriyaki Glazed BLT Burger, Ahi Poke Salad, Seared Sesame Ahi Salad "
58,On The Border,"10789 Westview Parkway San Diego, CA 92126",(858) 530-1130,"Bussines hour: 1 Happy hour: 11:00 AM -  7:00 PM Today deal: $4.95 14oz. Bud Light or Coors Light Draft, Exotico Reposado Tequila, House Wine / $6 Cocktails: Jack Daniels, Captain Morgan's or Absolut / $6.50 House Margarita / $6.95 18oz. Dos XX Draft, 22oz. Domestic Draft, Long Island Iced Tea, Latitude 33 Blood Orange IPA / $8.95 Patron Silver Shot, Dos A'Rita, Borderita, Exotico Skinny Margarita, 27oz. Super Grande Margarita $4.95 Cup of Queso, Empanadas (3), Pork Mini Tacos (3), Chicken Chimis (2) / $6.95 Chicken Quesadilla, Rolled Tacos, Half Order Stacked Nachos, Fried Pickled Jalapeños, Guacamole Appetizer / $8.95 Queso Fries, California Tacos (2), Guac/Queso Duo","Bussines hour: 1 Happy hour: 11:00 AM -  7:00 PM Today deal: $4.95 14oz. Bud Light or Coors Light Draft, Exotico Reposado Tequila, House Wine / $6 Cocktails: Jack Daniels, Captain Morgan's or Absolut / $6.50 House Margarita / $6.95 18oz. Dos XX Draft, 22oz. Domestic Draft, Long Island Iced Tea, Latitude 33 Blood Orange IPA / $8.95 Patron Silver Shot, Dos A'Rita, Borderita, Exotico Skinny Margarita, 27oz. Super Grande Margarita $4.95 Cup of Queso, Empanadas (3), Pork Mini Tacos (3), Chicken Chimis (2) / $6.95 Chicken Quesadilla, Rolled Tacos, Half Order Stacked Nachos, Fried Pickled Jalapeños, Guacamole Appetizer / $8.95 Queso Fries, California Tacos (2), Guac/Queso Duo","Bussines hour: : Happy hour: 3:00 PM -  7:00 PM Today deal: $4.95 14oz. Bud Light or Coors Light Draft, Exotico Reposado Tequila, House Wine / $6 Cocktails: Jack Daniels, Captain Morgan's or Absolut / $6.50 House Margarita / $6.95 18oz. Dos XX Draft, 22oz. Domestic Draft, Long Island Iced Tea, Latitude 33 Blood Orange IPA / $8.95 Patron Silver Shot, Dos A'Rita, Borderita, Exotico Skinny Margarita, 27oz. Super Grande Margarita $4.95 Cup of Queso, Empanadas (3), Pork Mini Tacos (3), Chicken Chimis (2) / $6.95 Chicken Quesadilla, Rolled Tacos, Half Order Stacked Nachos, Fried Pickled Jalapeños, Guacamole Appetizer / $8.95 Queso Fries, California Tacos (2), Guac/Queso Duo","Bussines hour: 0 Happy hour: 3:00 PM -  7:00 PM Today deal: $4.95 14oz. Bud Light or Coors Light Draft, Exotico Reposado Tequila, House Wine / $6 Cocktails: Jack Daniels, Captain Morgan's or Absolut / $6.50 House Margarita / $6.95 18oz. Dos XX Draft, 22oz. Domestic Draft, Long Island Iced Tea, Latitude 33 Blood Orange IPA / $8.95 Patron Silver Shot, Dos A'Rita, Borderita, Exotico Skinny Margarita, 27oz. Super Grande Margarita $4.95 Cup of Queso, Empanadas (3), Pork Mini Tacos (3), Chicken Chimis (2) / $6.95 Chicken Quesadilla, Rolled Tacos, Half Order Stacked Nachos, Fried Pickled Jalapeños, Guacamole Appetizer / $8.95 Queso Fries, California Tacos (2), Guac/Queso Duo","Bussines hour: 0 Happy hour: 3:00 PM -  7:00 PM Today deal: $4.95 14oz. Bud Light or Coors Light Draft, Exotico Reposado Tequila, House Wine / $6 Cocktails: Jack Daniels, Captain Morgan's or Absolut / $6.50 House Margarita / $6.95 18oz. Dos XX Draft, 22oz. Domestic Draft, Long Island Iced Tea, Latitude 33 Blood Orange IPA / $8.95 Patron Silver Shot, Dos A'Rita, Borderita, Exotico Skinny Margarita, 27oz. Super Grande Margarita $4.95 Cup of Queso, Empanadas (3), Pork Mini Tacos (3), Chicken Chimis (2) / $6.95 Chicken Quesadilla, Rolled Tacos, Half Order Stacked Nachos, Fried Pickled Jalapeños, Guacamole Appetizer / $8.95 Queso Fries, California Tacos (2), Guac/Queso Duo","Bussines hour:   Happy hour: 3:00 PM -  7:00 PM Today deal: $4.95 14oz. Bud Light or Coors Light Draft, Exotico Reposado Tequila, House Wine / $6 Cocktails: Jack Daniels, Captain Morgan's or Absolut / $6.50 House Margarita / $6.95 18oz. Dos XX Draft, 22oz. Domestic Draft, Long Island Iced Tea, Latitude 33 Blood Orange IPA / $8.95 Patron Silver Shot, Dos A'Rita, Borderita, Exotico Skinny Margarita, 27oz. Super Grande Margarita $4.95 Cup of Queso, Empanadas (3), Pork Mini Tacos (3), Chicken Chimis (2) / $6.95 Chicken Quesadilla, Rolled Tacos, Half Order Stacked Nachos, Fried Pickled Jalapeños, Guacamole Appetizer / $8.95 Queso Fries, California Tacos (2), Guac/Queso Duo","Bussines hour: A Happy hour: 3:00 PM -  7:00 PM Today deal: $4.95 14oz. Bud Light or Coors Light Draft, Exotico Reposado Tequila, House Wine / $6 Cocktails: Jack Daniels, Captain Morgan's or Absolut / $6.50 House Margarita / $6.95 18oz. Dos XX Draft, 22oz. Domestic Draft, Long Island Iced Tea, Latitude 33 Blood Orange IPA / $8.95 Patron Silver Shot, Dos A'Rita, Borderita, Exotico Skinny Margarita, 27oz. Super Grande Margarita $4.95 Cup of Queso, Empanadas (3), Pork Mini Tacos (3), Chicken Chimis (2) / $6.95 Chicken Quesadilla, Rolled Tacos, Half Order Stacked Nachos, Fried Pickled Jalapeños, Guacamole Appetizer / $8.95 Queso Fries, California Tacos (2), Guac/Queso Duo"
59,Break Point Bar & Restaurant ,"945 Garnet Ave. San Diego, CA 92109",(858) 274-4018,Bussines hour: 1 Happy hour: Not Happy Hour Today deal: No Specials,Bussines hour: 1 Happy hour: 4:00 PM -  7:00 PM Today deal: No Specials,"Bussines hour: : Happy hour: 4:00 PM -  7:00 PM Today deal: $2 Off Draft Beers / $5 Well Drinks, CK Mondavi Wine Varietals (Cabernet Sauvignon, Sauvignon Blanc, Chardonnay), Cazadores Blanco or Reposado Tequila Shot / $7 House Margarita $5 House Cut Fries / $7 Beer Battered Onion Rings / $8 Cheesy Garlic Bread / $10 Fried Calamari, Sweet 'n Spicy Cauliflower / $12 Hummus Board, Tomato Bacon Flatbread / $13 BBQ Chicken Flatbread / $14 Garlic Shrimp Fundido Dip / $15 Loaded Fries","Bussines hour: 0 Happy hour: 4:00 PM -  7:00 PM Today deal: $2 Off Draft Beers / $5 Well Drinks, CK Mondavi Wine Varietals (Cabernet Sauvignon, Sauvignon Blanc, Chardonnay), Cazadores Blanco or Reposado Tequila Shot / $7 House Margarita $5 House Cut Fries / $7 Beer Battered Onion Rings / $8 Cheesy Garlic Bread / $10 Fried Calamari, Sweet 'n Spicy Cauliflower / $12 Hummus Board, Tomato Bacon Flatbread / $13 BBQ Chicken Flatbread / $14 Garlic Shrimp Fundido Dip / $15 Loaded Fries","Bussines hour: 0 Happy hour: 4:00 PM -  7:00 PM Today deal: $2 Off Draft Beers / $5 Well Drinks, CK Mondavi Wine Varietals (Cabernet Sauvignon, Sauvignon Blanc, Chardonnay), Cazadores Blanco or Reposado Tequila Shot / $7 House Margarita $5 House Cut Fries / $7 Beer Battered Onion Rings / $8 Cheesy Garlic Bread / $10 Fried Calamari, Sweet 'n Spicy Cauliflower / $12 Hummus Board, Tomato Bacon Flatbread / $13 BBQ Chicken Flatbread / $14 Garlic Shrimp Fundido Dip / $15 Loaded Fries","Bussines hour:   Happy hour: 4:00 PM -  7:00 PM Today deal: $2 Off Draft Beers / $5 Well Drinks, CK Mondavi Wine Varietals (Cabernet Sauvignon, Sauvignon Blanc, Chardonnay), Cazadores Blanco or Reposado Tequila Shot / $7 House Margarita $5 House Cut Fries / $7 Beer Battered Onion Rings / $8 Cheesy Garlic Bread / $10 Fried Calamari, Sweet 'n Spicy Cauliflower / $12 Hummus Board, Tomato Bacon Flatbread / $13 BBQ Chicken Flatbread / $14 Garlic Shrimp Fundido Dip / $15 Loaded Fries","Bussines hour: A Happy hour: Not Happy Hour Today deal: $2 Off Draft Beers / $5 Well Drinks, CK Mondavi Wine Varietals (Cabernet Sauvignon, Sauvignon Blanc, Chardonnay), Cazadores Blanco or Reposado Tequila Shot / $7 House Margarita $5 House Cut Fries / $7 Beer Battered Onion Rings / $8 Cheesy Garlic Bread / $10 Fried Calamari, Sweet 'n Spicy Cauliflower / $12 Hummus Board, Tomato Bacon Flatbread / $13 BBQ Chicken Flatbread / $14 Garlic Shrimp Fundido Dip / $15 Loaded Fries"
60,BJ's Restaurant and Brewery,"5500 Grossmont Center Dr. La Mesa, CA 91941",(619) 589-7222,"Bussines hour: 1 Happy hour: 9:00 PM - 12:00 AM Today deal: $1 Off BJ's Seasonal & Guest Draft Beers / $4 Domestic Bottles / $5 BJ's Handcrafted Beers (excludes seasonal and specialty beers) & Dark Horse Wines / $6 Brewhouse Margarita & Call Drinks $4 Chips & Dips / $7 Select Appetizers, Mini Deep Dish Pizzas","Bussines hour: 1 Happy hour: 3:00 PM -  7:00 PM Today deal: $1 Off BJ's Seasonal & Guest Draft Beers / $4 Domestic Bottles / $5 BJ's Handcrafted Beers (excludes seasonal and specialty beers) & Dark Horse Wines / $6 Brewhouse Margarita & Call Drinks $4 Chips & Dips / $7 Select Appetizers, Mini Deep Dish Pizzas","Bussines hour: : Happy hour: 3:00 PM -  7:00 PM Today deal: $1 Off BJ's Seasonal & Guest Draft Beers / $4 Domestic Bottles / $5 BJ's Handcrafted Beers (excludes seasonal and specialty beers) & Dark Horse Wines / $6 Brewhouse Margarita & Call Drinks $4 Chips & Dips / $7 Select Appetizers, Mini Deep Dish Pizzas","Bussines hour: 0 Happy hour: 3:00 PM -  7:00 PM Today deal: $1 Off BJ's Seasonal & Guest Draft Beers / $4 Domestic Bottles / $5 BJ's Handcrafted Beers (excludes seasonal and specialty beers) & Dark Horse Wines / $6 Brewhouse Margarita & Call Drinks $4 Chips & Dips / $7 Select Appetizers, Mini Deep Dish Pizzas","Bussines hour: 0 Happy hour: 3:00 PM -  7:00 PM Today deal: $1 Off BJ's Seasonal & Guest Draft Beers / $4 Domestic Bottles / $5 BJ's Handcrafted Beers (excludes seasonal and specialty beers) & Dark Horse Wines / $6 Brewhouse Margarita & Call Drinks $4 Chips & Dips / $7 Select Appetizers, Mini Deep Dish Pizzas","Bussines hour:   Happy hour: 3:00 PM -  7:00 PM Today deal: $1 Off BJ's Seasonal & Guest Draft Beers / $4 Domestic Bottles / $5 BJ's Handcrafted Beers (excludes seasonal and specialty beers) & Dark Horse Wines / $6 Brewhouse Margarita & Call Drinks $4 Chips & Dips / $7 Select Appetizers, Mini Deep Dish Pizzas","Bussines hour: A Happy hour: 4:00 PM - 12:00 AM Today deal: $1 Off BJ's Seasonal & Guest Draft Beers / $4 Domestic Bottles / $5 BJ's Handcrafted Beers (excludes seasonal and specialty beers) & Dark Horse Wines / $6 Brewhouse Margarita & Call Drinks $4 Chips & Dips / $7 Select Appetizers, Mini Deep Dish Pizzas"
61,BullsEye Bar @ Black Angus Steakhouse,"707 E St. Chula Vista, CA 91910",(619) 426-9200 ,Bussines hour: 3 Happy hour: Not Happy Hour Today deal: No Specials,Bussines hour: : Happy hour: 3:00 PM -  6:00 PM Today deal: No Specials,"Bussines hour: 0 Happy hour: 3:00 PM -  6:00 PM Today deal: $2 Off Any 6oz. Wine Available by the Glass / $4 Select Draft Beer ($1 Off All Other 16oz. Draft Beer) / $6 Select Cocktails, All Well Drinks / $8.50 Messy Michelada $7 Loaded Potato Skins, Crispy Fried Garlic Pepper Zucchini, Shrimp Cocktail, Chicken Tenders (Chipotle-Buffalo or original), Baked Spinach & Artichoke Dip, Three Cheese Garlic Bread / $11.99 Chili Lime Chicken Bites / $14.99 Wagon Wheel Sampler (Crispy Fried Garlic-Pepper Zucchini, Chipotle-Buffalo Chicken Tenders, Loaded Potato Skins & Shrimp Cocktail)","Bussines hour: 0 Happy hour: 3:00 PM -  6:00 PM Today deal: $2 Off Any 6oz. Wine Available by the Glass / $4 Select Draft Beer ($1 Off All Other 16oz. Draft Beer) / $6 Select Cocktails, All Well Drinks / $8.50 Messy Michelada $7 Loaded Potato Skins, Crispy Fried Garlic Pepper Zucchini, Shrimp Cocktail, Chicken Tenders (Chipotle-Buffalo or original), Baked Spinach & Artichoke Dip, Three Cheese Garlic Bread / $11.99 Chili Lime Chicken Bites / $14.99 Wagon Wheel Sampler (Crispy Fried Garlic-Pepper Zucchini, Chipotle-Buffalo Chicken Tenders, Loaded Potato Skins & Shrimp Cocktail)","Bussines hour:   Happy hour: 3:00 PM -  6:00 PM Today deal: $2 Off Any 6oz. Wine Available by the Glass / $4 Select Draft Beer ($1 Off All Other 16oz. Draft Beer) / $6 Select Cocktails, All Well Drinks / $8.50 Messy Michelada $7 Loaded Potato Skins, Crispy Fried Garlic Pepper Zucchini, Shrimp Cocktail, Chicken Tenders (Chipotle-Buffalo or original), Baked Spinach & Artichoke Dip, Three Cheese Garlic Bread / $11.99 Chili Lime Chicken Bites / $14.99 Wagon Wheel Sampler (Crispy Fried Garlic-Pepper Zucchini, Chipotle-Buffalo Chicken Tenders, Loaded Potato Skins & Shrimp Cocktail)","Bussines hour: P Happy hour: 3:00 PM -  6:00 PM Today deal: $2 Off Any 6oz. Wine Available by the Glass / $4 Select Draft Beer ($1 Off All Other 16oz. Draft Beer) / $6 Select Cocktails, All Well Drinks / $8.50 Messy Michelada $7 Loaded Potato Skins, Crispy Fried Garlic Pepper Zucchini, Shrimp Cocktail, Chicken Tenders (Chipotle-Buffalo or original), Baked Spinach & Artichoke Dip, Three Cheese Garlic Bread / $11.99 Chili Lime Chicken Bites / $14.99 Wagon Wheel Sampler (Crispy Fried Garlic-Pepper Zucchini, Chipotle-Buffalo Chicken Tenders, Loaded Potato Skins & Shrimp Cocktail)","Bussines hour: M Happy hour: Not Happy Hour Today deal: $2 Off Any 6oz. Wine Available by the Glass / $4 Select Draft Beer ($1 Off All Other 16oz. Draft Beer) / $6 Select Cocktails, All Well Drinks / $8.50 Messy Michelada $7 Loaded Potato Skins, Crispy Fried Garlic Pepper Zucchini, Shrimp Cocktail, Chicken Tenders (Chipotle-Buffalo or original), Baked Spinach & Artichoke Dip, Three Cheese Garlic Bread / $11.99 Chili Lime Chicken Bites / $14.99 Wagon Wheel Sampler (Crispy Fried Garlic-Pepper Zucchini, Chipotle-Buffalo Chicken Tenders, Loaded Potato Skins & Shrimp Cocktail)"
62,Wheat & Water,"5737 La Jolla Blvd. La Jolla, CA 92037",(858) 291-8690,"Bussines hour: 1 Happy hour: 4:00 PM -  8:00 PM Today deal: Buy Any Pizza, Get $10 Off Any Pitcher of Beer","Bussines hour: 2 Happy hour: 4:00 PM -  6:00 PM Today deal: Buy Any Pizza, Get $10 Off Any Pitcher of Beer","Bussines hour: : Happy hour: 4:00 PM -  6:00 PM Today deal: $5 Select Beers / $7 House Wines by the Glass / $8 Well Spirits $5 BBQ Kalua Pig Slider, Carnitas Taco / $6 Fish Taco / $8 Butter Noodles / $9 Loaded Fries / $10 Carnitas Nachos, Red Sauce Noodles","Bussines hour: 0 Happy hour: 4:00 PM -  6:00 PM Today deal: $5 Select Beers / $7 House Wines by the Glass / $8 Well Spirits $5 BBQ Kalua Pig Slider, Carnitas Taco / $6 Fish Taco / $8 Butter Noodles / $9 Loaded Fries / $10 Carnitas Nachos, Red Sauce Noodles","Bussines hour: 0 Happy hour: 4:00 PM -  6:00 PM Today deal: $5 Select Beers / $7 House Wines by the Glass / $8 Well Spirits $5 BBQ Kalua Pig Slider, Carnitas Taco / $6 Fish Taco / $8 Butter Noodles / $9 Loaded Fries / $10 Carnitas Nachos, Red Sauce Noodles","Bussines hour:   Happy hour: 4:00 PM -  6:00 PM Today deal: $5 Select Beers / $7 House Wines by the Glass / $8 Well Spirits $5 BBQ Kalua Pig Slider, Carnitas Taco / $6 Fish Taco / $8 Butter Noodles / $9 Loaded Fries / $10 Carnitas Nachos, Red Sauce Noodles","Bussines hour: P Happy hour: 8:00 PM - 10:00 PM Today deal: $5 Select Beers / $7 House Wines by the Glass / $8 Well Spirits $5 BBQ Kalua Pig Slider, Carnitas Taco / $6 Fish Taco / $8 Butter Noodles / $9 Loaded Fries / $10 Carnitas Nachos, Red Sauce Noodles"
63,Steamy Piggy,"4681 Convoy St. San Diego, CA 92111",(858) 492-0401,"Bussines hour: 3 Happy hour: 3:00 PM -  6:00 PM Today deal: $4.50 Sapporo or Tsingtao / $5.50 Select Specialty Cocktails / $10.50 Soju $11.50 Bulgogi Fries / $12.50 Salt N' Pepper Wings / $15 Bao or Taco Flight (3): Piggy, Bulgogi, Chicken","Bussines hour: : Happy hour: 3:00 PM -  6:00 PM Today deal: $4.50 Sapporo or Tsingtao / $5.50 Select Specialty Cocktails / $10.50 Soju $11.50 Bulgogi Fries / $12.50 Salt N' Pepper Wings / $15 Bao or Taco Flight (3): Piggy, Bulgogi, Chicken","Bussines hour: 0 Happy hour: 3:00 PM -  6:00 PM Today deal: $4.50 Sapporo or Tsingtao / $5.50 Select Specialty Cocktails / $10.50 Soju $11.50 Bulgogi Fries / $12.50 Salt N' Pepper Wings / $15 Bao or Taco Flight (3): Piggy, Bulgogi, Chicken","Bussines hour: 0 Happy hour: 3:00 PM -  6:00 PM Today deal: $4.50 Sapporo or Tsingtao / $5.50 Select Specialty Cocktails / $10.50 Soju $11.50 Bulgogi Fries / $12.50 Salt N' Pepper Wings / $15 Bao or Taco Flight (3): Piggy, Bulgogi, Chicken","Bussines hour:   Happy hour: 3:00 PM -  6:00 PM Today deal: $4.50 Sapporo or Tsingtao / $5.50 Select Specialty Cocktails / $10.50 Soju $11.50 Bulgogi Fries / $12.50 Salt N' Pepper Wings / $15 Bao or Taco Flight (3): Piggy, Bulgogi, Chicken","Bussines hour: P Happy hour: 3:00 PM -  6:00 PM Today deal: $4.50 Sapporo or Tsingtao / $5.50 Select Specialty Cocktails / $10.50 Soju $11.50 Bulgogi Fries / $12.50 Salt N' Pepper Wings / $15 Bao or Taco Flight (3): Piggy, Bulgogi, Chicken","Bussines hour: M Happy hour: 3:00 PM -  6:00 PM Today deal: $4.50 Sapporo or Tsingtao / $5.50 Select Specialty Cocktails / $10.50 Soju $11.50 Bulgogi Fries / $12.50 Salt N' Pepper Wings / $15 Bao or Taco Flight (3): Piggy, Bulgogi, Chicken"
