,Name,Location,Contact Number,Sunday,Monday,Tuesday,Wednesday,Thursday,Friday,Saturday
24,Firefly Eatery & Bar,"1710 W. Mission Bay Dr. San Diego, CA 92109",(619) 222-6440,"Bussines hour: 7 Happy hour: 3:00 PM -  5:00 PM Today deal: $6 Draft Beer / $9 House Made Sangria, Select Wine by the Glass / $12 Select Signature Cocktails $9 Chicken Tortilla Soup / $10 Guacamole & Chips, Cheese Flatbread / $11 Clam Chowder / $15 Chicken Caesar Salad, Ceviche, Fish Tacos / $19 1/2lb. Wagyu Bacon Burger w/Fries","Bussines hour: : Happy hour: 3:00 PM -  5:00 PM Today deal: $6 Draft Beer / $9 House Made Sangria, Select Wine by the Glass / $12 Select Signature Cocktails $9 Chicken Tortilla Soup / $10 Guacamole & Chips, Cheese Flatbread / $11 Clam Chowder / $15 Chicken Caesar Salad, Ceviche, Fish Tacos / $19 1/2lb. Wagyu Bacon Burger w/Fries","Bussines hour: 0 Happy hour: 3:00 PM -  5:00 PM Today deal: $6 Draft Beer / $9 House Made Sangria, Select Wine by the Glass / $12 Select Signature Cocktails $9 Chicken Tortilla Soup / $10 Guacamole & Chips, Cheese Flatbread / $11 Clam Chowder / $15 Chicken Caesar Salad, Ceviche, Fish Tacos / $19 1/2lb. Wagyu Bacon Burger w/Fries","Bussines hour: 0 Happy hour: 3:00 PM -  5:00 PM Today deal: $6 Draft Beer / $9 House Made Sangria, Select Wine by the Glass / $12 Select Signature Cocktails $9 Chicken Tortilla Soup / $10 Guacamole & Chips, Cheese Flatbread / $11 Clam Chowder / $15 Chicken Caesar Salad, Ceviche, Fish Tacos / $19 1/2lb. Wagyu Bacon Burger w/Fries","Bussines hour:   Happy hour: 3:00 PM -  5:00 PM Today deal: $6 Draft Beer / $9 House Made Sangria, Select Wine by the Glass / $12 Select Signature Cocktails $9 Chicken Tortilla Soup / $10 Guacamole & Chips, Cheese Flatbread / $11 Clam Chowder / $15 Chicken Caesar Salad, Ceviche, Fish Tacos / $19 1/2lb. Wagyu Bacon Burger w/Fries","Bussines hour: A Happy hour: 3:00 PM -  5:00 PM Today deal: $6 Draft Beer / $9 House Made Sangria, Select Wine by the Glass / $12 Select Signature Cocktails $9 Chicken Tortilla Soup / $10 Guacamole & Chips, Cheese Flatbread / $11 Clam Chowder / $15 Chicken Caesar Salad, Ceviche, Fish Tacos / $19 1/2lb. Wagyu Bacon Burger w/Fries","Bussines hour: M Happy hour: 3:00 PM -  5:00 PM Today deal: $6 Draft Beer / $9 House Made Sangria, Select Wine by the Glass / $12 Select Signature Cocktails $9 Chicken Tortilla Soup / $10 Guacamole & Chips, Cheese Flatbread / $11 Clam Chowder / $15 Chicken Caesar Salad, Ceviche, Fish Tacos / $19 1/2lb. Wagyu Bacon Burger w/Fries"
25,Til Two Club,"4746 El Cajon Blvd. San Diego, CA 92115",(619) 255-1481,Bussines hour: 4 Happy hour: 4:00 PM -  7:00 PM Today deal: $3 Menu Shots / $4 Well Drinks / $5 Drafts / $35 Payable by Death Cocktail Pitcher / $40 I'm the Firestarter Cocktail Pitcher,Bussines hour: : Happy hour: 4:00 PM -  7:00 PM Today deal: $3 Menu Shots / $4 Well Drinks / $5 Drafts / $35 Payable by Death Cocktail Pitcher / $40 I'm the Firestarter Cocktail Pitcher,Bussines hour: 0 Happy hour: 4:00 PM -  7:00 PM Today deal: $3 Menu Shots / $4 Well Drinks / $5 Drafts / $35 Payable by Death Cocktail Pitcher / $40 I'm the Firestarter Cocktail Pitcher $3 Menu Shots / $4 Well Drinks / $5 Drafts / $35 Payable by Death Cocktail Pitcher / $40 I'm the Firestarter Cocktail Pitcher,Bussines hour: 0 Happy hour: 4:00 PM -  7:00 PM Today deal: $3 Menu Shots / $4 Well Drinks / $5 Drafts / $35 Payable by Death Cocktail Pitcher / $40 I'm the Firestarter Cocktail Pitcher $3 Menu Shots / $4 Well Drinks / $5 Drafts / $35 Payable by Death Cocktail Pitcher / $40 I'm the Firestarter Cocktail Pitcher,Bussines hour:   Happy hour: 4:00 PM -  7:00 PM Today deal: $3 Menu Shots / $4 Well Drinks / $5 Drafts / $35 Payable by Death Cocktail Pitcher / $40 I'm the Firestarter Cocktail Pitcher $3 Menu Shots / $4 Well Drinks / $5 Drafts / $35 Payable by Death Cocktail Pitcher / $40 I'm the Firestarter Cocktail Pitcher,Bussines hour: P Happy hour: 4:00 PM -  7:00 PM Today deal: $3 Menu Shots / $4 Well Drinks / $5 Drafts / $35 Payable by Death Cocktail Pitcher / $40 I'm the Firestarter Cocktail Pitcher,Bussines hour: M Happy hour: 4:00 PM -  7:00 PM Today deal: $3 Menu Shots / $4 Well Drinks / $5 Drafts / $35 Payable by Death Cocktail Pitcher / $40 I'm the Firestarter Cocktail Pitcher
26,Nason's Beer Hall,"550 J St. San Diego, CA 92101",(619) 738-7060,Bussines hour: 3 Happy hour: 10:00 AM -  2:00 PM Today deal: $25 Bottle of Campo Viejo & OJ Carafe $7 - $37 Brunch Menu,Bussines hour: : Happy hour: 3:00 PM -  5:00 PM Today deal: $25 Bottle of Campo Viejo & OJ Carafe $7 - $37 Brunch Menu,Bussines hour: 0 Happy hour: 3:00 PM -  5:00 PM Today deal: $25 Bottle of Campo Viejo & OJ Carafe $7 - $37 Brunch Menu,"Bussines hour: 0 Happy hour: 3:00 PM -  5:00 PM Today deal: $5 Draft Beers / $6 House Wines / $7 Well Cocktails $7 Animal Style Tots, Jalapeño Popper Cream Cheese Wonton (3), Chips & Guacamole, Carnitas Nachos","Bussines hour:   Happy hour: 3:00 PM -  5:00 PM Today deal: $5 Draft Beers / $6 House Wines / $7 Well Cocktails $7 Animal Style Tots, Jalapeño Popper Cream Cheese Wonton (3), Chips & Guacamole, Carnitas Nachos","Bussines hour: P Happy hour: 3:00 PM -  5:00 PM Today deal: $5 Draft Beers / $6 House Wines / $7 Well Cocktails $7 Animal Style Tots, Jalapeño Popper Cream Cheese Wonton (3), Chips & Guacamole, Carnitas Nachos","Bussines hour: M Happy hour: 10:00 AM -  2:00 PM Today deal: $5 Draft Beers / $6 House Wines / $7 Well Cocktails $7 Animal Style Tots, Jalapeño Popper Cream Cheese Wonton (3), Chips & Guacamole, Carnitas Nachos"
27,Pioneer BBQ ,"8622 Lake Murray Blvd. San Diego, CA 92119",(619) 825-7787,Bussines hour: 1 Happy hour: 12:00 PM -  8:00 PM Today deal: $12 Tall Boy + Shot of Jack / $17 Bottle of Bubbles [A 5% surcharge will be added to all Guest checks to help cover increasing costs in employee wages / benefits.],Bussines hour: 2 Happy hour: 4:00 PM -  8:00 PM Today deal: $12 Tall Boy + Shot of Jack / $17 Bottle of Bubbles [A 5% surcharge will be added to all Guest checks to help cover increasing costs in employee wages / benefits.],Bussines hour: : Happy hour: 4:00 PM -  6:00 PM Today deal: $12 Tall Boy + Shot of Jack / $17 Bottle of Bubbles [A 5% surcharge will be added to all Guest checks to help cover increasing costs in employee wages / benefits.],"Bussines hour: 0 Happy hour: 4:00 PM -  6:00 PM Today deal: $5 Well Cocktails & House Wines / $6 Select Drafts $8 Frito Pie / $9 Best Mac & Cheese, BBQ Pulled Pork Sliders (2), Chicken & Waffles / $15 Classic Burger w/Fries + a Draft Beer (add cheese +$1)","Bussines hour: 0 Happy hour: 4:00 PM -  6:00 PM Today deal: $5 Well Cocktails & House Wines / $6 Select Drafts $8 Frito Pie / $9 Best Mac & Cheese, BBQ Pulled Pork Sliders (2), Chicken & Waffles / $15 Classic Burger w/Fries + a Draft Beer (add cheese +$1)","Bussines hour:   Happy hour: 4:00 PM -  6:00 PM Today deal: $5 Well Cocktails & House Wines / $6 Select Drafts $8 Frito Pie / $9 Best Mac & Cheese, BBQ Pulled Pork Sliders (2), Chicken & Waffles / $15 Classic Burger w/Fries + a Draft Beer (add cheese +$1)","Bussines hour: P Happy hour: 12:00 PM -  9:00 PM Today deal: $5 Well Cocktails & House Wines / $6 Select Drafts $8 Frito Pie / $9 Best Mac & Cheese, BBQ Pulled Pork Sliders (2), Chicken & Waffles / $15 Classic Burger w/Fries + a Draft Beer (add cheese +$1)"
28,Aqua Mare Cucina Italiana," 2282 Carmel Valley Rd Del Mar, CA 92014",(858) 755-7100,"Bussines hour: 1 Happy hour: 4:00 PM -  6:00 PM Today deal: $5 Draft Beer / $8 Well Cocktails, Wine by the Glass (Select Red, White & Sparkling) $9 Gnocchi Alla Romana, Polpette Vegane, Ciliegine de Mozzarella Alla Caprese / $11 Polenta Aqua Mare, Fritturina All'Italiana, Pinsa Dello Chef / $13 Carciofi Alla Romana (grilled Roman-style artichokes), Melanzane Alla Parmigiana (eggplant parmigiana) / $15 Calamari Fritti","Bussines hour: 1 Happy hour: 4:00 PM -  6:00 PM Today deal: $5 Draft Beer / $8 Well Cocktails, Wine by the Glass (Select Red, White & Sparkling) $9 Gnocchi Alla Romana, Polpette Vegane, Ciliegine de Mozzarella Alla Caprese / $11 Polenta Aqua Mare, Fritturina All'Italiana, Pinsa Dello Chef / $13 Carciofi Alla Romana (grilled Roman-style artichokes), Melanzane Alla Parmigiana (eggplant parmigiana) / $15 Calamari Fritti","Bussines hour: : Happy hour: 4:00 PM -  6:00 PM Today deal: $5 Draft Beer / $8 Well Cocktails, Wine by the Glass (Select Red, White & Sparkling) $9 Gnocchi Alla Romana, Polpette Vegane, Ciliegine de Mozzarella Alla Caprese / $11 Polenta Aqua Mare, Fritturina All'Italiana, Pinsa Dello Chef / $13 Carciofi Alla Romana (grilled Roman-style artichokes), Melanzane Alla Parmigiana (eggplant parmigiana) / $15 Calamari Fritti","Bussines hour: 3 Happy hour: 4:00 PM -  6:00 PM Today deal: $5 Draft Beer / $8 Well Cocktails, Wine by the Glass (Select Red, White & Sparkling) $9 Gnocchi Alla Romana, Polpette Vegane, Ciliegine de Mozzarella Alla Caprese / $11 Polenta Aqua Mare, Fritturina All'Italiana, Pinsa Dello Chef / $13 Carciofi Alla Romana (grilled Roman-style artichokes), Melanzane Alla Parmigiana (eggplant parmigiana) / $15 Calamari Fritti","Bussines hour: 0 Happy hour: 4:00 PM -  6:00 PM Today deal: $5 Draft Beer / $8 Well Cocktails, Wine by the Glass (Select Red, White & Sparkling) $9 Gnocchi Alla Romana, Polpette Vegane, Ciliegine de Mozzarella Alla Caprese / $11 Polenta Aqua Mare, Fritturina All'Italiana, Pinsa Dello Chef / $13 Carciofi Alla Romana (grilled Roman-style artichokes), Melanzane Alla Parmigiana (eggplant parmigiana) / $15 Calamari Fritti","Bussines hour:   Happy hour: 4:00 PM -  6:00 PM Today deal: $5 Draft Beer / $8 Well Cocktails, Wine by the Glass (Select Red, White & Sparkling) $9 Gnocchi Alla Romana, Polpette Vegane, Ciliegine de Mozzarella Alla Caprese / $11 Polenta Aqua Mare, Fritturina All'Italiana, Pinsa Dello Chef / $13 Carciofi Alla Romana (grilled Roman-style artichokes), Melanzane Alla Parmigiana (eggplant parmigiana) / $15 Calamari Fritti","Bussines hour: A Happy hour: 4:00 PM -  6:00 PM Today deal: $5 Draft Beer / $8 Well Cocktails, Wine by the Glass (Select Red, White & Sparkling) $9 Gnocchi Alla Romana, Polpette Vegane, Ciliegine de Mozzarella Alla Caprese / $11 Polenta Aqua Mare, Fritturina All'Italiana, Pinsa Dello Chef / $13 Carciofi Alla Romana (grilled Roman-style artichokes), Melanzane Alla Parmigiana (eggplant parmigiana) / $15 Calamari Fritti"
29,Bare Back Bar & Grill,"4640 Mission Blvd. San Diego, CA 92109",(858) 274-7117,Bussines hour: 1 Happy hour: 10:00 AM -  9:00 PM Today deal: $4 Mimosas / $10 Bloody Marys or Micheladas,Bussines hour: 0 Happy hour: 3:00 PM -  6:00 PM Today deal: $4 Mimosas / $10 Bloody Marys or Micheladas,"Bussines hour: : Happy hour: 3:00 PM -  6:00 PM Today deal: $7 Craft Beer / $10 Craft Cocktails $7 Sliders: Meso Tasty, QTown Fave, Black Bean Kiwilango, Bare Lil Lamb / $9 Hummus & Veggies, Shrimp Skewers, Hot Young Tenders, Soft Pretzel","Bussines hour: 0 Happy hour: 3:00 PM -  6:00 PM Today deal: $7 Craft Beer / $10 Craft Cocktails $7 Sliders: Meso Tasty, QTown Fave, Black Bean Kiwilango, Bare Lil Lamb / $9 Hummus & Veggies, Shrimp Skewers, Hot Young Tenders, Soft Pretzel","Bussines hour: 0 Happy hour: 3:00 PM -  6:00 PM Today deal: $7 Craft Beer / $10 Craft Cocktails $7 Sliders: Meso Tasty, QTown Fave, Black Bean Kiwilango, Bare Lil Lamb / $9 Hummus & Veggies, Shrimp Skewers, Hot Young Tenders, Soft Pretzel","Bussines hour:   Happy hour: 3:00 PM -  6:00 PM Today deal: $7 Craft Beer / $10 Craft Cocktails $7 Sliders: Meso Tasty, QTown Fave, Black Bean Kiwilango, Bare Lil Lamb / $9 Hummus & Veggies, Shrimp Skewers, Hot Young Tenders, Soft Pretzel","Bussines hour: A Happy hour: 10:00 AM - 10:00 PM Today deal: $7 Craft Beer / $10 Craft Cocktails $7 Sliders: Meso Tasty, QTown Fave, Black Bean Kiwilango, Bare Lil Lamb / $9 Hummus & Veggies, Shrimp Skewers, Hot Young Tenders, Soft Pretzel"
30,Draft Republic,"5958 Avenida Encinas Carlsbad, CA 92008",(760) 448-4627,"Bussines hour: 3 Happy hour: 4:00 PM -  5:30 PM Today deal: $6 16oz. Draft Republic House Brews / $7 Select House Wine & Well Cocktails, Any Rouleur Brewing Co. Beer Selection / $9 26oz. House Draft Republic Beers $7.95 Chop Chop Salad, Bavarian Pretzel Bites, Buttermilk Chicken Lollipops (hot sauce, stout bbq sauce or sweet & spicy chili-lime sauce), Crispy Buffalo Cauliflower / $8.95 Bo Beau's Crispy Brussels Sprouts / $9.95 Draft Republic Beef Sliders (2), Sausage Sampler / $10.95 Poke Tacos (2) / $19.95 Burger or Sandwich + 16oz. House Draft Republic Beer (excludes 26oz. & promotional beers)","Bussines hour: : Happy hour: 4:00 PM -  5:30 PM Today deal: $6 16oz. Draft Republic House Brews / $7 Select House Wine & Well Cocktails, Any Rouleur Brewing Co. Beer Selection / $9 26oz. House Draft Republic Beers $7.95 Chop Chop Salad, Bavarian Pretzel Bites, Buttermilk Chicken Lollipops (hot sauce, stout bbq sauce or sweet & spicy chili-lime sauce), Crispy Buffalo Cauliflower / $8.95 Bo Beau's Crispy Brussels Sprouts / $9.95 Draft Republic Beef Sliders (2), Sausage Sampler / $10.95 Poke Tacos (2) / $19.95 Burger or Sandwich + 16oz. House Draft Republic Beer (excludes 26oz. & promotional beers)","Bussines hour: 0 Happy hour: 4:00 PM -  5:30 PM Today deal: $6 16oz. Draft Republic House Brews / $7 Select House Wine & Well Cocktails, Any Rouleur Brewing Co. Beer Selection / $9 26oz. House Draft Republic Beers $7.95 Chop Chop Salad, Bavarian Pretzel Bites, Buttermilk Chicken Lollipops (hot sauce, stout bbq sauce or sweet & spicy chili-lime sauce), Crispy Buffalo Cauliflower / $8.95 Bo Beau's Crispy Brussels Sprouts / $9.95 Draft Republic Beef Sliders (2), Sausage Sampler / $10.95 Poke Tacos (2) / $19.95 Burger or Sandwich + 16oz. House Draft Republic Beer (excludes 26oz. & promotional beers)","Bussines hour: 0 Happy hour: 4:00 PM -  5:30 PM Today deal: $6 16oz. Draft Republic House Brews / $7 Select House Wine & Well Cocktails, Any Rouleur Brewing Co. Beer Selection / $9 26oz. House Draft Republic Beers $7.95 Chop Chop Salad, Bavarian Pretzel Bites, Buttermilk Chicken Lollipops (hot sauce, stout bbq sauce or sweet & spicy chili-lime sauce), Crispy Buffalo Cauliflower / $8.95 Bo Beau's Crispy Brussels Sprouts / $9.95 Draft Republic Beef Sliders (2), Sausage Sampler / $10.95 Poke Tacos (2) / $19.95 Burger or Sandwich + 16oz. House Draft Republic Beer (excludes 26oz. & promotional beers)","Bussines hour:   Happy hour: 4:00 PM -  5:30 PM Today deal: $6 16oz. Draft Republic House Brews / $7 Select House Wine & Well Cocktails, Any Rouleur Brewing Co. Beer Selection / $9 26oz. House Draft Republic Beers $7.95 Chop Chop Salad, Bavarian Pretzel Bites, Buttermilk Chicken Lollipops (hot sauce, stout bbq sauce or sweet & spicy chili-lime sauce), Crispy Buffalo Cauliflower / $8.95 Bo Beau's Crispy Brussels Sprouts / $9.95 Draft Republic Beef Sliders (2), Sausage Sampler / $10.95 Poke Tacos (2) / $19.95 Burger or Sandwich + 16oz. House Draft Republic Beer (excludes 26oz. & promotional beers)","Bussines hour: P Happy hour: 4:00 PM -  5:30 PM Today deal: $6 16oz. Draft Republic House Brews / $7 Select House Wine & Well Cocktails, Any Rouleur Brewing Co. Beer Selection / $9 26oz. House Draft Republic Beers $7.95 Chop Chop Salad, Bavarian Pretzel Bites, Buttermilk Chicken Lollipops (hot sauce, stout bbq sauce or sweet & spicy chili-lime sauce), Crispy Buffalo Cauliflower / $8.95 Bo Beau's Crispy Brussels Sprouts / $9.95 Draft Republic Beef Sliders (2), Sausage Sampler / $10.95 Poke Tacos (2) / $19.95 Burger or Sandwich + 16oz. House Draft Republic Beer (excludes 26oz. & promotional beers)","Bussines hour: M Happy hour: 4:00 PM -  5:30 PM Today deal: $6 16oz. Draft Republic House Brews / $7 Select House Wine & Well Cocktails, Any Rouleur Brewing Co. Beer Selection / $9 26oz. House Draft Republic Beers $7.95 Chop Chop Salad, Bavarian Pretzel Bites, Buttermilk Chicken Lollipops (hot sauce, stout bbq sauce or sweet & spicy chili-lime sauce), Crispy Buffalo Cauliflower / $8.95 Bo Beau's Crispy Brussels Sprouts / $9.95 Draft Republic Beef Sliders (2), Sausage Sampler / $10.95 Poke Tacos (2) / $19.95 Burger or Sandwich + 16oz. House Draft Republic Beer (excludes 26oz. & promotional beers)"
31,Draft Republic,"255 Redel Rd. San Marcos, CA 92078",(760) 290-3520,"Bussines hour: 4 Happy hour: 4:00 PM -  5:30 PM Today deal: $6 16oz. Draft Republic House Brews / $7 Select House Wine & Well Cocktails, Any Rouleur Brewing Co. Beer Selection / $9 26oz. House Draft Republic Beers $7.95 Chop Chop Salad, Bavarian Pretzel Bites, Buttermilk Chicken Lollipops (hot sauce, stout bbq sauce or sweet & spicy chili-lime sauce), Crispy Buffalo Cauliflower / $8.95 Bo Beau's Crispy Brussels Sprouts / $9.95 Draft Republic Beef Sliders (2), Sausage Sampler / $10.95 Poke Tacos (2) / $19.95 Burger or Sandwich + 16oz. House Draft Republic Beer (excludes 26oz. & promotional beers)","Bussines hour: : Happy hour: 4:00 PM -  5:30 PM Today deal: $6 16oz. Draft Republic House Brews / $7 Select House Wine & Well Cocktails, Any Rouleur Brewing Co. Beer Selection / $9 26oz. House Draft Republic Beers $7.95 Chop Chop Salad, Bavarian Pretzel Bites, Buttermilk Chicken Lollipops (hot sauce, stout bbq sauce or sweet & spicy chili-lime sauce), Crispy Buffalo Cauliflower / $8.95 Bo Beau's Crispy Brussels Sprouts / $9.95 Draft Republic Beef Sliders (2), Sausage Sampler / $10.95 Poke Tacos (2) / $19.95 Burger or Sandwich + 16oz. House Draft Republic Beer (excludes 26oz. & promotional beers)","Bussines hour: 0 Happy hour: 4:00 PM -  5:30 PM Today deal: $6 16oz. Draft Republic House Brews / $7 Select House Wine & Well Cocktails, Any Rouleur Brewing Co. Beer Selection / $9 26oz. House Draft Republic Beers $7.95 Chop Chop Salad, Bavarian Pretzel Bites, Buttermilk Chicken Lollipops (hot sauce, stout bbq sauce or sweet & spicy chili-lime sauce), Crispy Buffalo Cauliflower / $8.95 Bo Beau's Crispy Brussels Sprouts / $9.95 Draft Republic Beef Sliders (2), Sausage Sampler / $10.95 Poke Tacos (2) / $19.95 Burger or Sandwich + 16oz. House Draft Republic Beer (excludes 26oz. & promotional beers)","Bussines hour: 0 Happy hour: 4:00 PM -  5:30 PM Today deal: $6 16oz. Draft Republic House Brews / $7 Select House Wine & Well Cocktails, Any Rouleur Brewing Co. Beer Selection / $9 26oz. House Draft Republic Beers $7.95 Chop Chop Salad, Bavarian Pretzel Bites, Buttermilk Chicken Lollipops (hot sauce, stout bbq sauce or sweet & spicy chili-lime sauce), Crispy Buffalo Cauliflower / $8.95 Bo Beau's Crispy Brussels Sprouts / $9.95 Draft Republic Beef Sliders (2), Sausage Sampler / $10.95 Poke Tacos (2) / $19.95 Burger or Sandwich + 16oz. House Draft Republic Beer (excludes 26oz. & promotional beers)","Bussines hour:   Happy hour: 4:00 PM -  5:30 PM Today deal: $6 16oz. Draft Republic House Brews / $7 Select House Wine & Well Cocktails, Any Rouleur Brewing Co. Beer Selection / $9 26oz. House Draft Republic Beers $7.95 Chop Chop Salad, Bavarian Pretzel Bites, Buttermilk Chicken Lollipops (hot sauce, stout bbq sauce or sweet & spicy chili-lime sauce), Crispy Buffalo Cauliflower / $8.95 Bo Beau's Crispy Brussels Sprouts / $9.95 Draft Republic Beef Sliders (2), Sausage Sampler / $10.95 Poke Tacos (2) / $19.95 Burger or Sandwich + 16oz. House Draft Republic Beer (excludes 26oz. & promotional beers)","Bussines hour: P Happy hour: 4:00 PM -  5:30 PM Today deal: $6 16oz. Draft Republic House Brews / $7 Select House Wine & Well Cocktails, Any Rouleur Brewing Co. Beer Selection / $9 26oz. House Draft Republic Beers $7.95 Chop Chop Salad, Bavarian Pretzel Bites, Buttermilk Chicken Lollipops (hot sauce, stout bbq sauce or sweet & spicy chili-lime sauce), Crispy Buffalo Cauliflower / $8.95 Bo Beau's Crispy Brussels Sprouts / $9.95 Draft Republic Beef Sliders (2), Sausage Sampler / $10.95 Poke Tacos (2) / $19.95 Burger or Sandwich + 16oz. House Draft Republic Beer (excludes 26oz. & promotional beers)","Bussines hour: M Happy hour: 4:00 PM -  5:30 PM Today deal: $6 16oz. Draft Republic House Brews / $7 Select House Wine & Well Cocktails, Any Rouleur Brewing Co. Beer Selection / $9 26oz. House Draft Republic Beers $7.95 Chop Chop Salad, Bavarian Pretzel Bites, Buttermilk Chicken Lollipops (hot sauce, stout bbq sauce or sweet & spicy chili-lime sauce), Crispy Buffalo Cauliflower / $8.95 Bo Beau's Crispy Brussels Sprouts / $9.95 Draft Republic Beef Sliders (2), Sausage Sampler / $10.95 Poke Tacos (2) / $19.95 Burger or Sandwich + 16oz. House Draft Republic Beer (excludes 26oz. & promotional beers)"
32,Crazee Burger,"3993 30th St. San Diego, CA 92104",(619) 282-6044,"Bussines hour: 1 Happy hour: 3:10 PM -  6:19 PM Today deal: $3.99 Crazee Fries / $4.49 Sweet Potato Fries / $4.99 Frings (1/2 fries + 1/2 onion rings), Springs (1/2 sweet potato + 1/2 onion rings), Winders (thick curly fries) / $8.99 Burger: Signature, Turkey or Veggie $15.49 Chicken Sandwich & Onion Rings - Served with a fountain drink. Substitute your fountain drink for a beer +$2.","Bussines hour: 1 Happy hour: 3:10 PM -  6:19 PM Today deal: $3.99 Crazee Fries / $4.49 Sweet Potato Fries / $4.99 Frings (1/2 fries + 1/2 onion rings), Springs (1/2 sweet potato + 1/2 onion rings), Winders (thick curly fries) / $8.99 Burger: Signature, Turkey or Veggie $15.49 Chicken Sandwich & Onion Rings - Served with a fountain drink. Substitute your fountain drink for a beer +$2.","Bussines hour: : Happy hour: 3:10 PM -  6:19 PM Today deal: $3.99 Crazee Fries / $4.49 Sweet Potato Fries / $4.99 Frings (1/2 fries + 1/2 onion rings), Springs (1/2 sweet potato + 1/2 onion rings), Winders (thick curly fries) / $8.99 Burger: Signature, Turkey or Veggie $15.49 Chicken Sandwich & Onion Rings - Served with a fountain drink. Substitute your fountain drink for a beer +$2.","Bussines hour: 0 Happy hour: 3:10 PM -  6:19 PM Today deal: $3.99 Crazee Fries / $4.49 Sweet Potato Fries / $4.99 Frings (1/2 fries + 1/2 onion rings), Springs (1/2 sweet potato + 1/2 onion rings), Winders (thick curly fries) / $8.99 Burger: Signature, Turkey or Veggie $14.49 Cheddar Burger w/Crazee Fries - Served with a fountain drink. Substitute your fountain drink for a beer +$2.","Bussines hour: 0 Happy hour: 3:10 PM -  6:19 PM Today deal: $3.99 Crazee Fries / $4.49 Sweet Potato Fries / $4.99 Frings (1/2 fries + 1/2 onion rings), Springs (1/2 sweet potato + 1/2 onion rings), Winders (thick curly fries) / $8.99 Burger: Signature, Turkey or Veggie $14.49 Cheddar Burger w/Crazee Fries - Served with a fountain drink. Substitute your fountain drink for a beer +$2.","Bussines hour:   Happy hour: 3:10 PM -  6:19 PM Today deal: $3.99 Crazee Fries / $4.49 Sweet Potato Fries / $4.99 Frings (1/2 fries + 1/2 onion rings), Springs (1/2 sweet potato + 1/2 onion rings), Winders (thick curly fries) / $8.99 Burger: Signature, Turkey or Veggie $14.49 Cheddar Burger w/Crazee Fries - Served with a fountain drink. Substitute your fountain drink for a beer +$2.","Bussines hour: A Happy hour: 3:10 PM -  6:19 PM Today deal: $3.99 Crazee Fries / $4.49 Sweet Potato Fries / $4.99 Frings (1/2 fries + 1/2 onion rings), Springs (1/2 sweet potato + 1/2 onion rings), Winders (thick curly fries) / $8.99 Burger: Signature, Turkey or Veggie $15.99 Santorini Burger w/Crazee Fries - Served with a fountain drink. Substitute your fountain drink for a beer +$2."
